SQLDATE,SOURCEURL,AvgTone,article_text
2016-11-10,http://www.cnn.com/2016/11/09/politics/donald-trumps-america/,-3.14685314685315,"In Donald Trump’s America, undocumented immigrants will be deported en masse, Arab Americans will be racially profiled and the United States will “bomb the s— out of ISIS.”
In Trump’s America, foreign Muslims will be banned from the US, Syrian refugees sent back to their war-torn country and free trade agreements torn to shreds. And, of course, the US will build a “great wall” on the US-Mexico border, which Mexico will have to pay for.
In Trump’s America, the US attorney general will push to indict the president’s general election rival.
That’s if everything goes as the Republican nominee has promised during his insurgent presidential campaign.
The newly-minted President-elect is now faced with the task of turning his hardline policy proposals into concrete legislative proposals and ultimately law. But with many of his more extreme proposals opposed even by some Republicans in Congress, Trump will face an uphill climb to implement the very proposals that drew his most ardent supporters to his insurgent campaign.
His challenges with uniting the American public behind his proposals were on clear display Wednesday as protests broke out from Boston to Los Angeles.
Should he succeed, though, in implementing the policies that carried him to victory in the Republican primaries and ultimately the general election, Trump would usher in a radical reimagining of the United States from its laws to its values.
Trump’s very election broke a set of barriers, becoming the first billionaire president and the first to have never before served in public office or the military. And while his business experience was a key part of his appeal to a broad swath of Americans, they will also raise unprecedented questions of conflict of interest and could pose challenges to his ability to sell legislative proposals that could affect his personal bottom line.
Beyond his businessman credo, it seems voters were most drawn to Trump’s promises to shake up Washington and implement radical change in every sector of government.
Obamacare
Trump has repeatedly promised to “immediately repeal and replace” Obamacare, to start. That is something congressional Republicans have been eager to accomplish, but unable to without a Republican president. But even with Trump in office, repealing and crafting a replacement for the law will be an arduous task in Congress, where Senate Democrats will fight the slim Republican majority’s efforts.
It’s still unclear exactly what Trump’s replacement will look like. He has vowed it will be “terrific” and said it will involve knocking down state insurance lines and incentivizing the establishment of health savings accounts.
Immigration
Even as Trump has unrelentingly promised at his rallies to build a wall on the US southern border with Mexico, his plan does not yet appear to have the backing of Republican Senate Majority Leader Mitch McConnell, who repeatedly dodged a question on whether he supports the wall.
“I want to achieve border security the way that’s most effective,” he told CNN’s Manu Raju Wednesday when asked about it.
The border wall proposal is just one of a slew of controversial immigration policies proffered by the real estate mogul, who launched his campaign by labeling undocumented Mexican immigrants criminals and “rapists.”
He has also vowed to deport all undocumented immigrants. In the latest iteration of that policy, he focused on the deportation of criminal undocumented immigrants, but he has not forsaken his pledge to deport all estimated 11 million who currently reside here illegally.
Trade
On trade, the Republican nominee has vowed to renegotiate or completely withdraw the US from NAFTA, the free trade agreement with Canada and Mexico that Trump has dubbed the “worst trade deal in history.” He could single-handedly do that without Congress, just as he could stymie the Trans-Pacific Partnership he has railed against.
He has also pledged to go after Chinese currency manipulation and impose additional tariffs of as much as 35% on certain foreign countries and on US companies that move their factories abroad – which could see consumer goods rise by that same percentage.
Trump’s presidency could radically alter the increasingly interconnected global economy, which has shot in the direction of more free trade, not less, in recent years. His presidency could usher in a more protectionist era.
Terrorism
Trump will also seek to rethink how the US combats terrorists, tossing aside the attempts by Presidents George W. Bush and Barack Obama to bring Muslim-Americans and other Muslim countries into the fold, rather than risk alienating them.
Trump has said he would seek to work with Muslim countries eager to join in the fight against ISIS, but he has also stoked Islamophobic sentiment in the US and proclaimed, “Islam hates us.”
His rhetoric on the campaign trail and policy proposals on that matter could prove a roadblock to those efforts of increased cooperation with Muslim majority countries. During his presidential bid, Trump called for the creation of a national database to register all Muslims living in the US, called for targeted surveillance of US mosques.
And last December, he famously called for a “total and complete shutdown of Muslims entering the United States,” a proposal he has never explicitly retracted. Trump has since focused on his “extreme vetting” proposal, which would include a ban on individuals from terror-prone countries, though he has not outlined which countries will be included in that list.
It is still unclear exactly how he will take on ISIS in Syria and Iraq. Trump has at times said he is open to sending in tens of thousands of US troops and consistently vowed to “bomb the s***t out of ISIS.”
At other times, he’s said he would like to keep the US out of the civil war in Syria, and instead favored ceding regional influence to Russia.
He has promised to work toward a closer relationship with Russia, which has ensconced itself as a top US adversary in recent years, and has promised to renegotiate the Iran deal, which he has trashed.
Economic policy
Trump’s economic proposals have focused on tearing down government regulations he views as overly burdensome on US businesses – which would include undoing environmental protections erected under the Obama administration – and reforming the US tax code.
But a cloud of uncertainty hangs over how the whopping across-the-board tax cuts he has promised will affect the US deficit. While he has promised to keep the proposals revenue-neutral, tax policy experts have said Trump’s proposals could add billions, if not trillions, of dollars to the US debt.
Ultimately, many in Washington and across the country are now wondering how much of Trump’s campaign promises will the soon-to-be president stick to once he walks into the Oval Office and the Situation Room.
Beyond the campaign promises and incendiary rhetoric during his 17 months campaigning for his job as president, Trump also repeatedly touted his willingness to compromise and reach “deals.”
Pressed on his immigration proposals in March on Fox News, Trump offered a simple reply: “Everything is negotiable.”"
2016-11-09,http://www.nytimes.com/2016/11/10/world/americas/donald-trump-foreign-policy.html,-3.75,
2016-11-08,http://www.foxnews.com/opinion/2016/11/08/very-real-threat-to-jobs-that-americans-need-to-remember-on-election-day.html,-4.3956043956044,"This has been an election campaign like no other. But amid so many surprises and so much controversy, some critical policy debates have been mostly overlooked. In the case of energy policy, millions of American workers may not realize their jobs are under threat, and they deserve to know why.
The threat comes from “keep it in the ground” groups totally opposed to fossil fuels, and the influence they are exerting over some political candidates this year. Groups like 350.org and Food & Water Watch want to ban hydraulic fracturing, often called fracking, an essential technology for producing domestic oil and natural gas. And the candidates have taken notice.
“By the time we get through all of my conditions, I do not think there will be many places in America where fracking will continue to take place,” presidential candidate Hillary Clinton said during the Democratic primary. “I’m going to pledge to stop fossil fuels,” she said at another time.
During the primary, Clinton was competing with U.S. Senator Bernie Sanders for the support of “keep it in the ground” activists. “Let me make it as clear as I can be … we are going to ban fracking in 50 states of this country,” Sanders said.
While Sanders eventually lost the primary to Clinton, he ensured that Bill McKibben – founder of 350.org and the leader of the “keep it in the ground” campaign – was appointed to the Democratic Party’s platform committee. McKibben has called for a “full-scale war” on global warming and pins the label of “climate denier” on anyone of proposes a single new oil and gas well.
The pressure coming from the environmental left should concern us all, because banning fracking would be extraordinarily costly. According to a new report from the U.S. Chamber of Commerce, the nation would lose 14.8 million jobs nationally by 2022, and not just in energy. The drastic reduction in domestic oil and gas supplies would drive up prices and return us to dependence on foreign energy imports, sending shockwaves through the economy and hurting other sectors like manufacturing.
“A ban on hydraulic fracturing would result in Ohio losing 400,000 jobs, with union jobs comprising a significant portion of this total,” the report from the Chamber’s Institute for 21st Century Energy states. “Our modeling indicates that $33 billion in state GDP in Ohio would be lost, with the majority of those losses attributed to the higher costs for energy that Ohio businesses would be forced to pay.”
These costs would also hit family budgets very hard. According to the report, living expenses for the average American household would jump by almost $3,500 per year. In Ohio, it would be worse, to the tune of $4,000 a year.
True, this has been an unorthodox year in American politics. But it’s stunning that any candidate – on the left or right – would play along with the idea of a national fracking ban when the economic impacts are so drastic. People not competing for votes from the radical left know better. Even President Obama has rushed to take credit for the lower energy prices made possible by fracking. “Gas is $2 a gallon,” he boasted in a recent speech. “Thanks, Obama!”
It’s tempting to shrug off the things candidates say on the campaign trail. So-called political experts will dismiss these remarks – and even full-fledged policy proposals – as unrealistic promises the candidates know they can’t keep.
But in the case of energy policy, we shouldn’t let the candidates off the hook, not when the stakes are so high. We should take them at their word, unless and until they are willing to retract those troubling statements.
And we should all ask ourselves why these candidates caved under pressure from “keep it in the ground” groups in the first place. Because if it happened once, it could happen again."
2016-11-09,http://www.nytimes.com/2016/11/10/world/americas/as-donald-trump-took-the-lead-canadas-immigration-website-buckled.html,-5.34124629080119,
2016-11-08,http://nation.foxnews.com/2016/11/07/last-call-america-trump-we-must-clean-corruption-clinton-ill-look-common-ground,2.38095238095238,"Not Available In Your Region
Fox Nation is only available in the United States and its territories.
Visit Fox News"
2016-11-09,http://latino.foxnews.com/latino/politics/2016/11/09/trump-presidential-win-elicits-disbelief-fears-and-some-cheers-around-world/,-1.25,"This material may not be published, broadcast, rewritten, or redistributed. ©2026 FOX News Network, LLC. All rights reserved. Quotes displayed in real-time or delayed by at least 15 minutes. Market data provided by Factset. Powered and implemented by FactSet Digital Solutions. Legal Statement. Mutual Fund and ETF data provided by LSEG."
2016-11-10,http://radio.foxnews.com/2016/11/10/president-elect-donald-trump-to-american-people-spectacular-things-headed-your-way/,3.47222222222223,"President-Elect Donald Trump to American People: “Spectacular Things” Headed Your Way
Following his Oval Office sit-down, President-elect Trump spent his afternoon with Congressional leadership.
FOX’s�Jared Halpern has more from the Capitol:
President-elect Trump emerged from a meeting with House Speaker Paul Ryan, promising to work rapdily on a legislative agenda that will include health care, immigration and taxes:
(President-elect Trump) “I think we’re going to do some absolutely spectacular things for the American people.”
Speaker Ryan offered the President-elect a look at the inaugural platform being constructed where Mr. Trump will be sworn-in next year. A view the President-elect called really, really beautiful, as he was led into his next meeting with Senate Majority Leader Mitch McConnell.
At the Capitol, Jared Halpern, FOX News."
2016-11-09,http://latino.foxnews.com/latino/politics/2016/11/09/trump-presidential-victory-triggers-protests-and-vigils-across-us/,-0.69444444444445,"This material may not be published, broadcast, rewritten, or redistributed. ©2026 FOX News Network, LLC. All rights reserved. Quotes displayed in real-time or delayed by at least 15 minutes. Market data provided by Factset. Powered and implemented by FactSet Digital Solutions. Legal Statement. Mutual Fund and ETF data provided by LSEG."
2016-11-09,http://radio.foxnews.com/2016/11/09/karl-rove-people-rose-up-voted-trump-because-they-were-tired-of-what-obama-has-done-to-america/,0.73529411764706,"Karl Rove: People Rose Up & Voted Trump Because They Were Tired Of What Obama Has Done To America
Karl Rove, former Deputy Chief of Staff and Senior Advisor to President George W. Bush, stopped by Kilmeade & Friends to break down how Donald Trump pulled off the upset victory over Hillary Clinton. Rove said he was blown away by Trump winning Wisconsin, something he thought would never happen. Karl also explained how Evangelicals played a big role in helping propel Trump to victory and how some of the rhetoric on the left has been more hurtful than anything Trump has said in the past.
Plus, Rove on how Bush 43 helped streamline the transition process from president to president-elect.
Watch here:"
2016-11-08,http://nation.foxnews.com/2016/11/08/election-day-2016-trump-or-clinton-time-decide-america-good-luck,1.22950819672131,"Not Available In Your Region
Fox Nation is only available in the United States and its territories.
Visit Fox News"
